<?xml version="1.0" encoding="UTF-8"?>
<root-element xmlns:xs="http://www.w3.org/2001/XMLSchema-instance"
xs:noNamespaceSchemaLocation="1.xsd">
    <a>A</a>
    <b>12345678A</b>
    <c>12345689P</c>
    <d>+123456789</d>
    <e>a21321</e>
    <f>ASabc123</f>
    <g>Alicia, Sanju</g>
    <h>adsadAdaDAasd</h>
    <i>01/07/2003</i>
    <j></j>
    <k></k>
    <l></l>
</root-element>
